{
  "schema_version": "issue-1606-boundary-review-request.v1",
  "repository": "liqiangcc/interview-lab",
  "parent_issue": 1605,
  "child_issue": 1606,
  "issue_number": 157,
  "source_note_id": "xhs-note:66141c29000000001a00c647",
  "source_id": "xhs:66141c29000000001a00c647",
  "live_url": "https://github.com/liqiangcc/interview-lab/issues/157",
  "expected_body_sha256": "24d58e3ba3118c7c8ee3b8df9c16c7d532a18cda6ed784a6f6aeaa34d6dd85ca",
  "expected_boundary_status": "pending",
  "expected_source_revision_id": "xhs-note:66141c29000000001a00c647:snapshot-95b77bb26104",
  "expected_source_repository": "liqiangcc/xhs",
  "expected_source_repository_ref": "95b77bb261048059846273688e4b90a2e108b437",
  "transition_id": "issue-1606-157-boundary-review-1",
  "reviewed_at": "2026-09-08T02:05:50Z",
  "reviewer_kind": "ai-assisted",
  "disposition": "ready",
  "decision": "not-interview",
  "evidence": {
    "artifact_ref": "liqiangcc/xhs:note_desc/66141c29000000001a00c647.txt@95b77bb261048059846273688e4b90a2e108b437",
    "artifact_provenance": "source_projection",
    "kind": "text_projection",
    "git_blob_sha": "8fb5cab5619d2adc7370c5f06e8a2268aa7ce4ca",
    "byte_size": 1715,
    "excerpts": [
      {
        "excerpt": "明天面试，今天就没刷题了~上次spring被拷打，今天才来看~明天上午还得去看看项目的内容，不然又是被拷打的份~啥时候才有那种面试官不要我是他们的损失的那种自信啊，不过今天spirng粗略的看了大概一半，感觉虽然说八股背的很死记硬背的感觉，但是看到项目里的知识点底层都是这样实现的，再回头看项目，真的就会有种通透的感觉了，第一遍看项目时的懵懂，现在再去看，肯定会运筹帷幄，也知道哪些是重点了，偶尔面试保持节奏还是很有用的，明天下午希望自己面完，赶紧刷了今天的题目，再补一补不知道的知识点，总之只要自己学起来，就感觉自己在路上了，回头一看，发现这都快4月十号了，俗话金三银四，这金银山都过去2/3了，啊哈哈哈，这谁顶得住，晚上还听到实验室的同学说她本科同学大四找工作的时候出去有项目简直就是宝藏了，什么字节小米都是随便去，年薪也有30+，结果现在读研找个2k的就算是很好了，瞬间觉得自己读研不值了，不过我是转专业到计算机了，感觉读书也是跟着一辈子的事情，毕竟一直会有个头衔，虽然挣不到那么多钱咯，但这些学历给予的东西，也不是随便能用钱换的（虽然也可以咯，啊哈哈哈）但既然都这样了，只能调侃一下，好好继续学咯，感觉每天都给自己打鸡血，逼着自己看下去，学下去，每天都是好快就过去了，明天面试还是希望保持初心，把每次都看成第一次，放平心态，不以物喜不以己悲！",
        "line": 4,
        "locator": "artifact-line:4"
      }
    ]
  },
  "checks": [
    {
      "check_id": "source_identity",
      "result": "pass",
      "note": "verified against frozen selection and exact Source projection; evidence=artifact-line:4"
    },
    {
      "check_id": "source_revision_binding",
      "result": "pass",
      "note": "verified against frozen selection and exact Source projection; evidence=artifact-line:4"
    },
    {
      "check_id": "source_content_coverage",
      "result": "pass",
      "note": "verified against frozen selection and exact Source projection; evidence=artifact-line:4"
    },
    {
      "check_id": "event_boundary",
      "result": "pass",
      "note": "Source projection explicitly identifies a simulation, curated or third-party submission, knowledge/advice, repost, warning, or other non-candidate-interview context."
    },
    {
      "check_id": "no_cross_source_mixing",
      "result": "pass",
      "note": "verified against frozen selection and exact Source projection; evidence=artifact-line:4"
    },
    {
      "check_id": "no_fabrication",
      "result": "pass",
      "note": "verified against frozen selection and exact Source projection; evidence=artifact-line:4"
    }
  ],
  "limitations": [
    "Boundary Review only determines whether 0/1/N InterviewNote case identity may be materialized; it does not write source-ready, InterviewContext, learning labels, or InterviewNote Issues.",
    "No live evidence comment or transition mutation is authorized by this artifact; any later apply must create/bind durable per-issue evidence and recheck body/state/source CAS."
  ]
}
