{
  "schema_version": "issue-1606-boundary-review-request.v1",
  "repository": "liqiangcc/interview-lab",
  "parent_issue": 1605,
  "child_issue": 1606,
  "issue_number": 258,
  "source_note_id": "xhs-note:66a05086000000000a024803",
  "source_id": "xhs:66a05086000000000a024803",
  "live_url": "https://github.com/liqiangcc/interview-lab/issues/258",
  "expected_body_sha256": "cdc5a699889f75aaa68846b6e0e079210c7b5ddd8e25f8f43f1875a29636c4a0",
  "expected_boundary_status": "pending",
  "expected_source_revision_id": "xhs-note:66a05086000000000a024803:snapshot-95b77bb26104",
  "expected_source_repository": "liqiangcc/xhs",
  "expected_source_repository_ref": "95b77bb261048059846273688e4b90a2e108b437",
  "transition_id": "issue-1606-258-boundary-review-1",
  "reviewed_at": "2026-09-08T17:18:04Z",
  "reviewer_kind": "ai-assisted",
  "disposition": "blocked",
  "decision": null,
  "evidence": {
    "artifact_ref": "liqiangcc/xhs:note_desc/66a05086000000000a024803.txt@95b77bb261048059846273688e4b90a2e108b437",
    "artifact_provenance": "source_projection",
    "kind": "text_projection",
    "git_blob_sha": "c2a7a16ff46eb4c988290a85dc15344671352bd2",
    "byte_size": 126,
    "excerpts": [
      {
        "excerpt": "#面经[话题]# #大厂[话题]# #java[话题]# #求职[话题]# #社招[话题]# #找工作[话题]# #金三银四[话题]#",
        "line": 1,
        "locator": "artifact-line:1"
      }
    ]
  },
  "checks": [
    {
      "check_id": "source_identity",
      "result": "pass",
      "note": "verified against frozen selection and exact Source projection; evidence=artifact-line:1"
    },
    {
      "check_id": "source_revision_binding",
      "result": "pass",
      "note": "verified against frozen selection and exact Source projection; evidence=artifact-line:1"
    },
    {
      "check_id": "source_content_coverage",
      "result": "pass",
      "note": "verified against frozen selection and exact Source projection; evidence=artifact-line:1"
    },
    {
      "check_id": "event_boundary",
      "result": "fail",
      "note": "Source projection contains no non-hashtag event text; title/labels cannot establish a candidate interview boundary."
    },
    {
      "check_id": "no_cross_source_mixing",
      "result": "pass",
      "note": "verified against frozen selection and exact Source projection; evidence=artifact-line:1"
    },
    {
      "check_id": "no_fabrication",
      "result": "pass",
      "note": "verified against frozen selection and exact Source projection; evidence=artifact-line:1"
    }
  ],
  "limitations": [
    "Boundary Review only determines whether 0/1/N InterviewNote case identity may be materialized; it does not write source-ready, InterviewContext, learning labels, or InterviewNote Issues.",
    "No live evidence comment or transition mutation is authorized by this artifact; any later apply must create/bind durable per-issue evidence and recheck body/state/source CAS.",
    "Source projection contains no non-hashtag event text; title/labels cannot establish a candidate interview boundary."
  ]
}
