{
  "schema_version": "issue-1606-boundary-review-request.v1",
  "repository": "liqiangcc/interview-lab",
  "parent_issue": 1605,
  "child_issue": 1606,
  "issue_number": 326,
  "source_note_id": "xhs-note:66e1032f000000000c019cd8",
  "source_id": "xhs:66e1032f000000000c019cd8",
  "live_url": "https://github.com/liqiangcc/interview-lab/issues/326",
  "expected_body_sha256": "0ab39ff97cace232408dba0be99d2189bef9ea150b021e8518a5127468219f45",
  "expected_boundary_status": "pending",
  "expected_source_revision_id": "xhs-note:66e1032f000000000c019cd8:snapshot-95b77bb26104",
  "expected_source_repository": "liqiangcc/xhs",
  "expected_source_repository_ref": "95b77bb261048059846273688e4b90a2e108b437",
  "transition_id": "issue-1606-326-boundary-review-1",
  "reviewed_at": "2026-09-08T02:05:50Z",
  "reviewer_kind": "ai-assisted",
  "disposition": "ready",
  "decision": "single-interview",
  "evidence": {
    "artifact_ref": "liqiangcc/xhs:note_desc/66e1032f000000000c019cd8.txt@95b77bb261048059846273688e4b90a2e108b437",
    "artifact_provenance": "source_projection",
    "kind": "text_projection",
    "git_blob_sha": "fbc1c40dbb5e1111d71963c2f31e3efe1c667449",
    "byte_size": 2263,
    "excerpts": [
      {
        "excerpt": "3. 设计模式，手撕单例",
        "line": 6,
        "locator": "artifact-line:6"
      }
    ]
  },
  "checks": [
    {
      "check_id": "source_identity",
      "result": "pass",
      "note": "verified against frozen selection and exact Source projection; evidence=artifact-line:6"
    },
    {
      "check_id": "source_revision_binding",
      "result": "pass",
      "note": "verified against frozen selection and exact Source projection; evidence=artifact-line:6"
    },
    {
      "check_id": "source_content_coverage",
      "result": "pass",
      "note": "verified against frozen selection and exact Source projection; evidence=artifact-line:6"
    },
    {
      "check_id": "event_boundary",
      "result": "pass",
      "note": "Source projection explicitly records a completed candidate interview event; no independent multi-event boundary is evidenced in the reviewed projection. Same-process rounds remain one case."
    },
    {
      "check_id": "no_cross_source_mixing",
      "result": "pass",
      "note": "verified against frozen selection and exact Source projection; evidence=artifact-line:6"
    },
    {
      "check_id": "no_fabrication",
      "result": "pass",
      "note": "verified against frozen selection and exact Source projection; evidence=artifact-line:6"
    }
  ],
  "limitations": [
    "Boundary Review only determines whether 0/1/N InterviewNote case identity may be materialized; it does not write source-ready, InterviewContext, learning labels, or InterviewNote Issues.",
    "No live evidence comment or transition mutation is authorized by this artifact; any later apply must create/bind durable per-issue evidence and recheck body/state/source CAS."
  ]
}
