{
  "schema_version": "issue-1606-boundary-review-request.v1",
  "repository": "liqiangcc/interview-lab",
  "parent_issue": 1605,
  "child_issue": 1606,
  "issue_number": 167,
  "source_note_id": "xhs-note:6622840f000000001c0078da",
  "source_id": "xhs:6622840f000000001c0078da",
  "live_url": "https://github.com/liqiangcc/interview-lab/issues/167",
  "expected_body_sha256": "d1ff7263cb384a44f3fec5c5dd196f92199b8c591d5082bd4878fc91a79e4321",
  "expected_boundary_status": "pending",
  "expected_source_revision_id": "xhs-note:6622840f000000001c0078da:snapshot-95b77bb26104",
  "expected_source_repository": "liqiangcc/xhs",
  "expected_source_repository_ref": "95b77bb261048059846273688e4b90a2e108b437",
  "transition_id": "issue-1606-167-boundary-review-1",
  "reviewed_at": "2026-09-08T02:05:50Z",
  "reviewer_kind": "ai-assisted",
  "disposition": "ready",
  "decision": "not-interview",
  "evidence": {
    "artifact_ref": "liqiangcc/xhs:note_desc/6622840f000000001c0078da.txt@95b77bb261048059846273688e4b90a2e108b437",
    "artifact_provenance": "source_projection",
    "kind": "text_projection",
    "git_blob_sha": "621c516ae1ed8d63ddba8da5b497d2084d58912b",
    "byte_size": 135,
    "excerpts": [
      {
        "excerpt": "任何的面试大家都要提前准备好哦，才能更好展示自己[萌萌哒R]#面经[话题]# #群面[话题]# #小米[话题]#",
        "line": 1,
        "locator": "artifact-line:1"
      }
    ]
  },
  "checks": [
    {
      "check_id": "source_identity",
      "result": "pass",
      "note": "verified against frozen selection and exact Source projection; evidence=artifact-line:1"
    },
    {
      "check_id": "source_revision_binding",
      "result": "pass",
      "note": "verified against frozen selection and exact Source projection; evidence=artifact-line:1"
    },
    {
      "check_id": "source_content_coverage",
      "result": "pass",
      "note": "verified against frozen selection and exact Source projection; evidence=artifact-line:1"
    },
    {
      "check_id": "event_boundary",
      "result": "pass",
      "note": "Source projection is advice, a question-bank compilation, or recruiting guidance rather than a bounded candidate-completed interview event."
    },
    {
      "check_id": "no_cross_source_mixing",
      "result": "pass",
      "note": "verified against frozen selection and exact Source projection; evidence=artifact-line:1"
    },
    {
      "check_id": "no_fabrication",
      "result": "pass",
      "note": "verified against frozen selection and exact Source projection; evidence=artifact-line:1"
    }
  ],
  "limitations": [
    "Boundary Review only determines whether 0/1/N InterviewNote case identity may be materialized; it does not write source-ready, InterviewContext, learning labels, or InterviewNote Issues.",
    "No live evidence comment or transition mutation is authorized by this artifact; any later apply must create/bind durable per-issue evidence and recheck body/state/source CAS."
  ]
}
