{
  "schema_version": "issue-1606-boundary-review-request.v1",
  "repository": "liqiangcc/interview-lab",
  "parent_issue": 1605,
  "child_issue": 1606,
  "issue_number": 228,
  "source_note_id": "xhs-note:667a5320000000001f0049d7",
  "source_id": "xhs:667a5320000000001f0049d7",
  "live_url": "https://github.com/liqiangcc/interview-lab/issues/228",
  "expected_body_sha256": "336a801d6cd2affdf51609a36a873fb101e368e43ca12a54bff08299626eeb5f",
  "expected_boundary_status": "pending",
  "expected_source_revision_id": "xhs-note:667a5320000000001f0049d7:snapshot-95b77bb26104",
  "expected_source_repository": "liqiangcc/xhs",
  "expected_source_repository_ref": "95b77bb261048059846273688e4b90a2e108b437",
  "transition_id": "issue-1606-228-boundary-review-1",
  "reviewed_at": "2026-09-08T02:05:50Z",
  "reviewer_kind": "ai-assisted",
  "disposition": "blocked",
  "decision": null,
  "evidence": {
    "artifact_ref": "liqiangcc/xhs:note_desc/667a5320000000001f0049d7.txt@95b77bb261048059846273688e4b90a2e108b437",
    "artifact_provenance": "source_projection",
    "kind": "text_projection",
    "git_blob_sha": "422b874df31f62a7f571113919a175431d6f2bcd",
    "byte_size": 128,
    "excerpts": [
      {
        "excerpt": "请说一下你对视图的理解。 #程序员[话题]#  #java[话题]#  #后端开发[话题]#  #开发面试[话题]#",
        "line": 1,
        "locator": "artifact-line:1"
      }
    ]
  },
  "checks": [
    {
      "check_id": "source_identity",
      "result": "pass",
      "note": "verified against frozen selection and exact Source projection; evidence=artifact-line:1"
    },
    {
      "check_id": "source_revision_binding",
      "result": "pass",
      "note": "verified against frozen selection and exact Source projection; evidence=artifact-line:1"
    },
    {
      "check_id": "source_content_coverage",
      "result": "pass",
      "note": "verified against frozen selection and exact Source projection; evidence=artifact-line:1"
    },
    {
      "check_id": "event_boundary",
      "result": "fail",
      "note": "Source projection contains an isolated question bank or question list, but no candidate-specific completed interaction, interviewer exchange, or bounded process is evidenced."
    },
    {
      "check_id": "no_cross_source_mixing",
      "result": "pass",
      "note": "verified against frozen selection and exact Source projection; evidence=artifact-line:1"
    },
    {
      "check_id": "no_fabrication",
      "result": "pass",
      "note": "verified against frozen selection and exact Source projection; evidence=artifact-line:1"
    }
  ],
  "limitations": [
    "Boundary Review only determines whether 0/1/N InterviewNote case identity may be materialized; it does not write source-ready, InterviewContext, learning labels, or InterviewNote Issues.",
    "No live evidence comment or transition mutation is authorized by this artifact; any later apply must create/bind durable per-issue evidence and recheck body/state/source CAS.",
    "Source projection contains an isolated question bank or question list, but no candidate-specific completed interaction, interviewer exchange, or bounded process is evidenced."
  ]
}
