{
  "schema_version": "issue-1606-boundary-review-request.v1",
  "repository": "liqiangcc/interview-lab",
  "parent_issue": 1605,
  "child_issue": 1606,
  "issue_number": 137,
  "source_note_id": "xhs-note:65fbc2a9000000001203c950",
  "source_id": "xhs:65fbc2a9000000001203c950",
  "live_url": "https://github.com/liqiangcc/interview-lab/issues/137",
  "expected_body_sha256": "55b6b965a93c6008d40e98b518727e524dcaca6840d20b85588033e357ff41b2",
  "expected_boundary_status": "pending",
  "expected_source_revision_id": "xhs-note:65fbc2a9000000001203c950:snapshot-95b77bb26104",
  "expected_source_repository": "liqiangcc/xhs",
  "expected_source_repository_ref": "95b77bb261048059846273688e4b90a2e108b437",
  "transition_id": "issue-1606-137-boundary-review-1",
  "reviewed_at": "2026-09-08T17:18:04Z",
  "reviewer_kind": "ai-assisted",
  "disposition": "ready",
  "decision": "single-interview",
  "evidence": {
    "artifact_ref": "liqiangcc/xhs:note_desc/65fbc2a9000000001203c950.txt@95b77bb261048059846273688e4b90a2e108b437",
    "artifact_provenance": "source_projection",
    "kind": "text_projection",
    "git_blob_sha": "6f8bd615ff188d9ff3e7af7b124a69b6a3c677ff",
    "byte_size": 1570,
    "excerpts": [
      {
        "excerpt": "3月21号，早上六点多就起来了，花了四块钱吃了个路边肠粉（最便宜的），因为面试的地点有点远，我必须要坐两个半小时的公交车，在十点之前赶到面试地点，9点40分，到面试地点，是真的偏，稀稀疏疏几个人，还有迷你无人电动车，悠然自得畅行。",
        "line": 4,
        "locator": "artifact-line:4"
      }
    ]
  },
  "checks": [
    {
      "check_id": "source_identity",
      "result": "pass",
      "note": "verified against frozen selection and exact Source projection; evidence=artifact-line:4"
    },
    {
      "check_id": "source_revision_binding",
      "result": "pass",
      "note": "verified against frozen selection and exact Source projection; evidence=artifact-line:4"
    },
    {
      "check_id": "source_content_coverage",
      "result": "pass",
      "note": "verified against frozen selection and exact Source projection; evidence=artifact-line:4"
    },
    {
      "check_id": "event_boundary",
      "result": "pass",
      "note": "Source projection explicitly records a completed candidate interview event; no independent multi-event boundary is evidenced in the reviewed projection. Same-process rounds remain one case."
    },
    {
      "check_id": "no_cross_source_mixing",
      "result": "pass",
      "note": "verified against frozen selection and exact Source projection; evidence=artifact-line:4"
    },
    {
      "check_id": "no_fabrication",
      "result": "pass",
      "note": "verified against frozen selection and exact Source projection; evidence=artifact-line:4"
    }
  ],
  "limitations": [
    "Boundary Review only determines whether 0/1/N InterviewNote case identity may be materialized; it does not write source-ready, InterviewContext, learning labels, or InterviewNote Issues.",
    "No live evidence comment or transition mutation is authorized by this artifact; any later apply must create/bind durable per-issue evidence and recheck body/state/source CAS."
  ]
}
