{
  "schema_version": "issue-1606-boundary-review-request.v1",
  "repository": "liqiangcc/interview-lab",
  "parent_issue": 1605,
  "child_issue": 1606,
  "issue_number": 196,
  "source_note_id": "xhs-note:66583167000000001500b0d2",
  "source_id": "xhs:66583167000000001500b0d2",
  "live_url": "https://github.com/liqiangcc/interview-lab/issues/196",
  "expected_body_sha256": "5a782927a90d4f6125fb030cc2422b7337e826aed90cf6c4d7b03cbaa911c972",
  "expected_boundary_status": "pending",
  "expected_source_revision_id": "xhs-note:66583167000000001500b0d2:snapshot-95b77bb26104",
  "expected_source_repository": "liqiangcc/xhs",
  "expected_source_repository_ref": "95b77bb261048059846273688e4b90a2e108b437",
  "transition_id": "issue-1606-196-boundary-review-1",
  "reviewed_at": "2026-09-08T02:05:50Z",
  "reviewer_kind": "ai-assisted",
  "disposition": "blocked",
  "decision": null,
  "evidence": {
    "artifact_ref": "liqiangcc/xhs:note_desc/66583167000000001500b0d2.txt@95b77bb261048059846273688e4b90a2e108b437",
    "artifact_provenance": "source_projection",
    "kind": "text_projection",
    "git_blob_sha": "54ca73c050d88c8b236b4875205ed07ac8a66f8c",
    "byte_size": 74,
    "excerpts": [
      {
        "excerpt": "#前端面试[话题]# #面经[话题]# #工作[话题]# #前端[话题]#",
        "line": 1,
        "locator": "artifact-line:1"
      }
    ]
  },
  "checks": [
    {
      "check_id": "source_identity",
      "result": "pass",
      "note": "verified against frozen selection and exact Source projection; evidence=artifact-line:1"
    },
    {
      "check_id": "source_revision_binding",
      "result": "pass",
      "note": "verified against frozen selection and exact Source projection; evidence=artifact-line:1"
    },
    {
      "check_id": "source_content_coverage",
      "result": "pass",
      "note": "verified against frozen selection and exact Source projection; evidence=artifact-line:1"
    },
    {
      "check_id": "event_boundary",
      "result": "fail",
      "note": "Source projection does not provide enough direct event-boundary evidence; retain boundary:pending rather than infer from title or hashtags."
    },
    {
      "check_id": "no_cross_source_mixing",
      "result": "pass",
      "note": "verified against frozen selection and exact Source projection; evidence=artifact-line:1"
    },
    {
      "check_id": "no_fabrication",
      "result": "pass",
      "note": "verified against frozen selection and exact Source projection; evidence=artifact-line:1"
    }
  ],
  "limitations": [
    "Boundary Review only determines whether 0/1/N InterviewNote case identity may be materialized; it does not write source-ready, InterviewContext, learning labels, or InterviewNote Issues.",
    "No live evidence comment or transition mutation is authorized by this artifact; any later apply must create/bind durable per-issue evidence and recheck body/state/source CAS.",
    "Source projection does not provide enough direct event-boundary evidence; retain boundary:pending rather than infer from title or hashtags."
  ]
}
