{
  "schema_version": "issue-1606-boundary-review-request.v1",
  "repository": "liqiangcc/interview-lab",
  "parent_issue": 1605,
  "child_issue": 1606,
  "issue_number": 102,
  "source_note_id": "xhs-note:65a4c789000000001101ed86",
  "source_id": "xhs:65a4c789000000001101ed86",
  "live_url": "https://github.com/liqiangcc/interview-lab/issues/102",
  "expected_body_sha256": "53d54addb1817039c00a4b8072d6a6825ff9a1a7c0033986e61f4e64b0e758fa",
  "expected_boundary_status": "pending",
  "expected_source_revision_id": "xhs-note:65a4c789000000001101ed86:snapshot-95b77bb26104",
  "expected_source_repository": "liqiangcc/xhs",
  "expected_source_repository_ref": "95b77bb261048059846273688e4b90a2e108b437",
  "transition_id": "issue-1606-102-boundary-review-1",
  "reviewed_at": "2026-09-08T02:05:50Z",
  "reviewer_kind": "ai-assisted",
  "disposition": "ready",
  "decision": "not-interview",
  "evidence": {
    "artifact_ref": "liqiangcc/xhs:note_desc/65a4c789000000001101ed86.txt@95b77bb261048059846273688e4b90a2e108b437",
    "artifact_provenance": "source_projection",
    "kind": "text_projection",
    "git_blob_sha": "5a1b56a69608327c955bf7d01b1feeb3e1a01c9c",
    "byte_size": 60,
    "excerpts": [
      {
        "excerpt": "java面试题#后端开发[话题]# #JAVA面试题[话题]#",
        "line": 1,
        "locator": "artifact-line:1"
      }
    ]
  },
  "checks": [
    {
      "check_id": "source_identity",
      "result": "pass",
      "note": "verified against frozen selection and exact Source projection; evidence=artifact-line:1"
    },
    {
      "check_id": "source_revision_binding",
      "result": "pass",
      "note": "verified against frozen selection and exact Source projection; evidence=artifact-line:1"
    },
    {
      "check_id": "source_content_coverage",
      "result": "pass",
      "note": "verified against frozen selection and exact Source projection; evidence=artifact-line:1"
    },
    {
      "check_id": "event_boundary",
      "result": "pass",
      "note": "Source projection is advice, a question-bank compilation, or recruiting guidance rather than a bounded candidate-completed interview event."
    },
    {
      "check_id": "no_cross_source_mixing",
      "result": "pass",
      "note": "verified against frozen selection and exact Source projection; evidence=artifact-line:1"
    },
    {
      "check_id": "no_fabrication",
      "result": "pass",
      "note": "verified against frozen selection and exact Source projection; evidence=artifact-line:1"
    }
  ],
  "limitations": [
    "Boundary Review only determines whether 0/1/N InterviewNote case identity may be materialized; it does not write source-ready, InterviewContext, learning labels, or InterviewNote Issues.",
    "No live evidence comment or transition mutation is authorized by this artifact; any later apply must create/bind durable per-issue evidence and recheck body/state/source CAS."
  ]
}
