{
  "schema_version": "issue-1606-boundary-review-request.v1",
  "repository": "liqiangcc/interview-lab",
  "parent_issue": 1605,
  "child_issue": 1606,
  "issue_number": 221,
  "source_note_id": "xhs-note:6671745d000000000d00e91c",
  "source_id": "xhs:6671745d000000000d00e91c",
  "live_url": "https://github.com/liqiangcc/interview-lab/issues/221",
  "expected_body_sha256": "67ffbddd4a35fa456f4ea7a1543050dd264e7dfa9457cf1038d0c983ebcb3152",
  "expected_boundary_status": "pending",
  "expected_source_revision_id": "xhs-note:6671745d000000000d00e91c:snapshot-95b77bb26104",
  "expected_source_repository": "liqiangcc/xhs",
  "expected_source_repository_ref": "95b77bb261048059846273688e4b90a2e108b437",
  "transition_id": "issue-1606-221-boundary-review-1",
  "reviewed_at": "2026-09-08T02:05:50Z",
  "reviewer_kind": "ai-assisted",
  "disposition": "blocked",
  "decision": null,
  "evidence": {
    "artifact_ref": "liqiangcc/xhs:note_desc/6671745d000000000d00e91c.txt@95b77bb261048059846273688e4b90a2e108b437",
    "artifact_provenance": "source_projection",
    "kind": "text_projection",
    "git_blob_sha": "8ca8ae1e851dc18523a99d35b132bf3f866e8506",
    "byte_size": 181,
    "excerpts": [
      {
        "excerpt": "#程序员[话题]#  #计算机[话题]#  #校招[话题]#  #秋招[话题]#  #大学生[话题]#  #互联网大厂[话题]#  #面试[话题]#  #面试技巧[话题]#",
        "line": 1,
        "locator": "artifact-line:1"
      }
    ]
  },
  "checks": [
    {
      "check_id": "source_identity",
      "result": "pass",
      "note": "verified against frozen selection and exact Source projection; evidence=artifact-line:1"
    },
    {
      "check_id": "source_revision_binding",
      "result": "pass",
      "note": "verified against frozen selection and exact Source projection; evidence=artifact-line:1"
    },
    {
      "check_id": "source_content_coverage",
      "result": "pass",
      "note": "verified against frozen selection and exact Source projection; evidence=artifact-line:1"
    },
    {
      "check_id": "event_boundary",
      "result": "fail",
      "note": "Source projection contains no non-hashtag event text; title/labels cannot establish a candidate interview boundary."
    },
    {
      "check_id": "no_cross_source_mixing",
      "result": "pass",
      "note": "verified against frozen selection and exact Source projection; evidence=artifact-line:1"
    },
    {
      "check_id": "no_fabrication",
      "result": "pass",
      "note": "verified against frozen selection and exact Source projection; evidence=artifact-line:1"
    }
  ],
  "limitations": [
    "Boundary Review only determines whether 0/1/N InterviewNote case identity may be materialized; it does not write source-ready, InterviewContext, learning labels, or InterviewNote Issues.",
    "No live evidence comment or transition mutation is authorized by this artifact; any later apply must create/bind durable per-issue evidence and recheck body/state/source CAS.",
    "Source projection contains no non-hashtag event text; title/labels cannot establish a candidate interview boundary."
  ]
}
