{
  "schema_version": "issue-1606-boundary-review-request.v1",
  "repository": "liqiangcc/interview-lab",
  "parent_issue": 1605,
  "child_issue": 1606,
  "issue_number": 292,
  "source_note_id": "xhs-note:66bf3579000000001e01da39",
  "source_id": "xhs:66bf3579000000001e01da39",
  "live_url": "https://github.com/liqiangcc/interview-lab/issues/292",
  "expected_body_sha256": "060f8de3607315d2403fdd289c0248590e461285f9ff8de36fbc82beb88be47c",
  "expected_boundary_status": "pending",
  "expected_source_revision_id": "xhs-note:66bf3579000000001e01da39:snapshot-95b77bb26104",
  "expected_source_repository": "liqiangcc/xhs",
  "expected_source_repository_ref": "95b77bb261048059846273688e4b90a2e108b437",
  "transition_id": "issue-1606-292-boundary-review-1",
  "reviewed_at": "2026-09-08T02:05:50Z",
  "reviewer_kind": "ai-assisted",
  "disposition": "blocked",
  "decision": null,
  "evidence": {
    "artifact_ref": "liqiangcc/xhs:note_desc/66bf3579000000001e01da39.txt@95b77bb261048059846273688e4b90a2e108b437",
    "artifact_provenance": "source_projection",
    "kind": "text_projection",
    "git_blob_sha": "534d34d9cadc0b8daea7ebe7bcd92c34b24c2b7e",
    "byte_size": 192,
    "excerpts": [
      {
        "excerpt": "c++岗",
        "line": 1,
        "locator": "artifact-line:1"
      }
    ]
  },
  "checks": [
    {
      "check_id": "source_identity",
      "result": "pass",
      "note": "verified against frozen selection and exact Source projection; evidence=artifact-line:1"
    },
    {
      "check_id": "source_revision_binding",
      "result": "pass",
      "note": "verified against frozen selection and exact Source projection; evidence=artifact-line:1"
    },
    {
      "check_id": "source_content_coverage",
      "result": "pass",
      "note": "verified against frozen selection and exact Source projection; evidence=artifact-line:1"
    },
    {
      "check_id": "event_boundary",
      "result": "fail",
      "note": "Source projection has interview-adjacent language but lacks a direct completed candidate interaction, bounded process, or reliable outcome context; retain boundary:pending."
    },
    {
      "check_id": "no_cross_source_mixing",
      "result": "pass",
      "note": "verified against frozen selection and exact Source projection; evidence=artifact-line:1"
    },
    {
      "check_id": "no_fabrication",
      "result": "pass",
      "note": "verified against frozen selection and exact Source projection; evidence=artifact-line:1"
    }
  ],
  "limitations": [
    "Boundary Review only determines whether 0/1/N InterviewNote case identity may be materialized; it does not write source-ready, InterviewContext, learning labels, or InterviewNote Issues.",
    "No live evidence comment or transition mutation is authorized by this artifact; any later apply must create/bind durable per-issue evidence and recheck body/state/source CAS.",
    "Source projection has interview-adjacent language but lacks a direct completed candidate interaction, bounded process, or reliable outcome context; retain boundary:pending."
  ]
}
